{
  "$schema": "https://json-schema.org/draft/2020-12/schema",
  "type": "object",
  "additionalProperties": false,
  "required": [
    "title",
    "description",
    "tests"
  ],
  "properties": {
    "title": {
      "$ref": "./shared.json#/$defs/NonEmptyText"
    },
    "description": {
      "$ref": "./shared.json#/$defs/NonEmptyText"
    },
    "stateful": {
      "type": "boolean"
    },
    "tests": {
      "type": "array",
      "minItems": 1,
      "items": {
        "oneOf": [
          {
            "$ref": "./btck_block_copy.json"
          },
          {
            "$ref": "./btck_block_count_transactions.json"
          },
          {
            "$ref": "./btck_block_create.json"
          },
          {
            "$ref": "./btck_block_destroy.json"
          },
          {
            "$ref": "./btck_block_get_hash.json"
          },
          {
            "$ref": "./btck_block_get_header.json"
          },
          {
            "$ref": "./btck_block_get_transaction_at.json"
          },
          {
            "$ref": "./btck_block_hash_copy.json"
          },
          {
            "$ref": "./btck_block_hash_create.json"
          },
          {
            "$ref": "./btck_block_hash_destroy.json"
          },
          {
            "$ref": "./btck_block_hash_equals.json"
          },
          {
            "$ref": "./btck_block_hash_to_bytes.json"
          },
          {
            "$ref": "./btck_block_header_copy.json"
          },
          {
            "$ref": "./btck_block_header_create.json"
          },
          {
            "$ref": "./btck_block_header_destroy.json"
          },
          {
            "$ref": "./btck_block_header_get_bits.json"
          },
          {
            "$ref": "./btck_block_header_get_hash.json"
          },
          {
            "$ref": "./btck_block_header_get_nonce.json"
          },
          {
            "$ref": "./btck_block_header_get_prev_hash.json"
          },
          {
            "$ref": "./btck_block_header_get_timestamp.json"
          },
          {
            "$ref": "./btck_block_header_get_version.json"
          },
          {
            "$ref": "./btck_block_to_bytes.json"
          },
          {
            "$ref": "./btck_block_tree_entry_get_block_hash.json"
          },
          {
            "$ref": "./btck_chain_contains.json"
          },
          {
            "$ref": "./btck_chain_get_by_height.json"
          },
          {
            "$ref": "./btck_chain_get_height.json"
          },
          {
            "$ref": "./btck_chainstate_manager_create.json"
          },
          {
            "$ref": "./btck_chainstate_manager_destroy.json"
          },
          {
            "$ref": "./btck_chainstate_manager_get_active_chain.json"
          },
          {
            "$ref": "./btck_chainstate_manager_process_block.json"
          },
          {
            "$ref": "./btck_context_create.json"
          },
          {
            "$ref": "./btck_context_destroy.json"
          },
          {
            "$ref": "./btck_precomputed_transaction_data_create.json"
          },
          {
            "$ref": "./btck_precomputed_transaction_data_destroy.json"
          },
          {
            "$ref": "./btck_script_pubkey_copy.json"
          },
          {
            "$ref": "./btck_script_pubkey_create.json"
          },
          {
            "$ref": "./btck_script_pubkey_destroy.json"
          },
          {
            "$ref": "./btck_script_pubkey_to_bytes.json"
          },
          {
            "$ref": "./btck_script_pubkey_verify.json"
          },
          {
            "$ref": "./btck_transaction_copy.json"
          },
          {
            "$ref": "./btck_transaction_count_inputs.json"
          },
          {
            "$ref": "./btck_transaction_count_outputs.json"
          },
          {
            "$ref": "./btck_transaction_create.json"
          },
          {
            "$ref": "./btck_transaction_destroy.json"
          },
          {
            "$ref": "./btck_transaction_get_input_at.json"
          },
          {
            "$ref": "./btck_transaction_get_output_at.json"
          },
          {
            "$ref": "./btck_transaction_get_txid.json"
          },
          {
            "$ref": "./btck_transaction_input_copy.json"
          },
          {
            "$ref": "./btck_transaction_input_destroy.json"
          },
          {
            "$ref": "./btck_transaction_input_get_out_point.json"
          },
          {
            "$ref": "./btck_transaction_out_point_copy.json"
          },
          {
            "$ref": "./btck_transaction_out_point_destroy.json"
          },
          {
            "$ref": "./btck_transaction_out_point_get_index.json"
          },
          {
            "$ref": "./btck_transaction_out_point_get_txid.json"
          },
          {
            "$ref": "./btck_transaction_output_copy.json"
          },
          {
            "$ref": "./btck_transaction_output_create.json"
          },
          {
            "$ref": "./btck_transaction_output_destroy.json"
          },
          {
            "$ref": "./btck_transaction_output_get_amount.json"
          },
          {
            "$ref": "./btck_transaction_output_get_script_pubkey.json"
          },
          {
            "$ref": "./btck_transaction_to_bytes.json"
          },
          {
            "$ref": "./btck_txid_copy.json"
          },
          {
            "$ref": "./btck_txid_destroy.json"
          },
          {
            "$ref": "./btck_txid_equals.json"
          },
          {
            "$ref": "./btck_txid_to_bytes.json"
          }
        ]
      }
    }
  }
}
