{
  "title": "Script Verification - P2SH-P2WPKH",
  "description": "Verifies a mainnet P2SH-P2WPKH output against two variants: valid witness sig (passes with P2SH + WITNESS and all pre-taproot flags), corrupted witness sig (fails with WITNESS enforced, passes with P2SH only). Mainnet tx 07dea5918a500d7476b1d116d80507a66bc2167681b2e6ca7dd99dbc6d95c31d.",
  "stateful": true,
  "tests": [
    {
      "description": "Create P2SH-P2WPKH script pubkey",
      "request": {
        "id": "script_verify_p2sh_p2wpkh#1",
        "method": "btck_script_pubkey_create",
        "params": {
          "script_pubkey": "a91434c06f8c87e355e123bdc6dda4ffabc64b6989ef87"
        },
        "ref": "$spk"
      },
      "expected_response": {
        "result": {
          "ref": "$spk"
        }
      }
    },
    {
      "description": "Create valid P2SH-P2WPKH transaction",
      "request": {
        "id": "script_verify_p2sh_p2wpkh#2",
        "method": "btck_transaction_create",
        "params": {
          "raw_transaction": "01000000000101d9fd94d0ff0026d307c994d0003180a5f248146efb6371d040c5973f5f66d9df0400000017160014b31b31a6cb654cfab3c50567bcf124f48a0beaecffffffff012cbd1c000000000017a914233b74bf0823fa58bbbd26dfc3bb4ae715547167870247304402206f60569cac136c114a58aedd80f6fa1c51b49093e7af883e605c212bdafcd8d202200e91a55f408a021ad2631bc29a67bd6915b2d7e9ef0265627eabd7f7234455f6012103e7e802f50344303c76d12c089c8724c1b230e3b745693bbe16aad536293d15e300000000"
        },
        "ref": "$tx_valid"
      },
      "expected_response": {
        "result": {
          "ref": "$tx_valid"
        }
      }
    },
    {
      "description": "Create precomputed transaction data for valid P2SH-P2WPKH",
      "request": {
        "id": "script_verify_p2sh_p2wpkh#3",
        "method": "btck_precomputed_transaction_data_create",
        "params": {
          "tx_to": {
            "ref": "$tx_valid"
          }
        },
        "ref": "$precomp_valid"
      },
      "expected_response": {
        "result": {
          "ref": "$precomp_valid"
        }
      }
    },
    {
      "description": "Verify valid P2SH-P2WPKH with btck_ScriptVerificationFlags_P2SH + btck_ScriptVerificationFlags_WITNESS",
      "request": {
        "id": "script_verify_p2sh_p2wpkh#4",
        "method": "btck_script_pubkey_verify",
        "params": {
          "script_pubkey": {
            "ref": "$spk"
          },
          "amount": 1900000,
          "tx_to": {
            "ref": "$tx_valid"
          },
          "precomputed_txdata": {
            "ref": "$precomp_valid"
          },
          "input_index": 0,
          "flags": [
            "btck_ScriptVerificationFlags_P2SH",
            "btck_ScriptVerificationFlags_WITNESS"
          ]
        }
      },
      "expected_response": {
        "result": true
      }
    },
    {
      "description": "Verify valid P2SH-P2WPKH with all pre-taproot flags",
      "request": {
        "id": "script_verify_p2sh_p2wpkh#5",
        "method": "btck_script_pubkey_verify",
        "params": {
          "script_pubkey": {
            "ref": "$spk"
          },
          "amount": 1900000,
          "tx_to": {
            "ref": "$tx_valid"
          },
          "precomputed_txdata": {
            "ref": "$precomp_valid"
          },
          "input_index": 0,
          "flags": [
            "btck_ScriptVerificationFlags_P2SH",
            "btck_ScriptVerificationFlags_DERSIG",
            "btck_ScriptVerificationFlags_NULLDUMMY",
            "btck_ScriptVerificationFlags_CHECKLOCKTIMEVERIFY",
            "btck_ScriptVerificationFlags_CHECKSEQUENCEVERIFY",
            "btck_ScriptVerificationFlags_WITNESS"
          ]
        }
      },
      "expected_response": {
        "result": true
      }
    },
    {
      "description": "Destroy precomputed transaction data for valid P2SH-P2WPKH",
      "request": {
        "id": "script_verify_p2sh_p2wpkh#6",
        "method": "btck_precomputed_transaction_data_destroy",
        "params": {
          "precomputed_txdata": {
            "ref": "$precomp_valid"
          }
        }
      },
      "expected_response": {
        "result": null
      }
    },
    {
      "description": "Destroy valid P2SH-P2WPKH transaction",
      "request": {
        "id": "script_verify_p2sh_p2wpkh#7",
        "method": "btck_transaction_destroy",
        "params": {
          "transaction": {
            "ref": "$tx_valid"
          }
        }
      },
      "expected_response": {
        "result": null
      }
    },
    {
      "description": "Create P2SH-P2WPKH transaction with corrupted signature (one byte flipped in witness)",
      "request": {
        "id": "script_verify_p2sh_p2wpkh#8",
        "method": "btck_transaction_create",
        "params": {
          "raw_transaction": "01000000000101d9fd94d0ff0026d307c994d0003180a5f248146efb6371d040c5973f5f66d9df0400000017160014b31b31a6cb654cfab3c50567bcf124f48a0beaecffffffff012cbd1c000000000017a914233b74bf0823fa58bbbd26dfc3bb4ae715547167870247304402206f60569cac136c114a58aedd80f6fa1c51b49093e7af883e615c212bdafcd8d202200e91a55f408a021ad2631bc29a67bd6915b2d7e9ef0265627eabd7f7234455f6012103e7e802f50344303c76d12c089c8724c1b230e3b745693bbe16aad536293d15e300000000"
        },
        "ref": "$tx_corrupted_sig"
      },
      "expected_response": {
        "result": {
          "ref": "$tx_corrupted_sig"
        }
      }
    },
    {
      "description": "Create precomputed transaction data for corrupted sig P2SH-P2WPKH",
      "request": {
        "id": "script_verify_p2sh_p2wpkh#9",
        "method": "btck_precomputed_transaction_data_create",
        "params": {
          "tx_to": {
            "ref": "$tx_corrupted_sig"
          }
        },
        "ref": "$precomp_corrupted_sig"
      },
      "expected_response": {
        "result": {
          "ref": "$precomp_corrupted_sig"
        }
      }
    },
    {
      "description": "Verify P2SH-P2WPKH with corrupted signature and btck_ScriptVerificationFlags_P2SH + btck_ScriptVerificationFlags_WITNESS - fails",
      "request": {
        "id": "script_verify_p2sh_p2wpkh#10",
        "method": "btck_script_pubkey_verify",
        "params": {
          "script_pubkey": {
            "ref": "$spk"
          },
          "amount": 1900000,
          "tx_to": {
            "ref": "$tx_corrupted_sig"
          },
          "precomputed_txdata": {
            "ref": "$precomp_corrupted_sig"
          },
          "input_index": 0,
          "flags": [
            "btck_ScriptVerificationFlags_P2SH",
            "btck_ScriptVerificationFlags_WITNESS"
          ]
        }
      },
      "expected_response": {
        "result": false
      }
    },
    {
      "description": "Verify P2SH-P2WPKH with corrupted signature and btck_ScriptVerificationFlags_P2SH only - passes (witness not enforced)",
      "request": {
        "id": "script_verify_p2sh_p2wpkh#11",
        "method": "btck_script_pubkey_verify",
        "params": {
          "script_pubkey": {
            "ref": "$spk"
          },
          "amount": 1900000,
          "tx_to": {
            "ref": "$tx_corrupted_sig"
          },
          "precomputed_txdata": {
            "ref": "$precomp_corrupted_sig"
          },
          "input_index": 0,
          "flags": [
            "btck_ScriptVerificationFlags_P2SH"
          ]
        }
      },
      "expected_response": {
        "result": true
      }
    },
    {
      "description": "Destroy precomputed transaction data for corrupted sig P2SH-P2WPKH",
      "request": {
        "id": "script_verify_p2sh_p2wpkh#12",
        "method": "btck_precomputed_transaction_data_destroy",
        "params": {
          "precomputed_txdata": {
            "ref": "$precomp_corrupted_sig"
          }
        }
      },
      "expected_response": {
        "result": null
      }
    },
    {
      "description": "Destroy corrupted sig P2SH-P2WPKH transaction",
      "request": {
        "id": "script_verify_p2sh_p2wpkh#13",
        "method": "btck_transaction_destroy",
        "params": {
          "transaction": {
            "ref": "$tx_corrupted_sig"
          }
        }
      },
      "expected_response": {
        "result": null
      }
    },
    {
      "description": "Destroy P2SH-P2WPKH script pubkey",
      "request": {
        "id": "script_verify_p2sh_p2wpkh#14",
        "method": "btck_script_pubkey_destroy",
        "params": {
          "script_pubkey": {
            "ref": "$spk"
          }
        }
      },
      "expected_response": {
        "result": null
      }
    }
  ]
}
